name,dateOfBirth,dateOfDeath,nationality,description,region,groups,imageURL
Steve Jobs,1955-02-24,2011-10-05,American,"Co-founder of Apple Inc. who revolutionized personal computing, smartphones, and digital media. The iPhone transformed global communication and technology.",North America,Economy,
Bill Gates,1955-10-28,,American,Co-founder of Microsoft who dominated personal computer software revolution. Later became major philanthropist through Gates Foundation focusing on global health.,North America,Economy,
Elon Musk,1971-06-28,,South African-American,"Entrepreneur who founded/leads Tesla, SpaceX, and other ventures. Pioneered electric vehicles and private space exploration, controversial social media presence.",North America,Economy,
Jeff Bezos,1964-01-12,,American,"Founded Amazon, transforming retail and cloud computing. Became world's wealthiest person; also founded Blue Origin space company.",North America,Economy,
Mark Zuckerberg,1984-05-14,,American,"Founded Facebook (Meta), creating world's largest social network connecting billions. Controversies over privacy, misinformation, and social impact.",North America,Economy,
Jack Ma (馬雲),1964-09-10,,Chinese,"Founded Alibaba, China's e-commerce giant. Became symbol of Chinese entrepreneurship before running afoul of government and retreating from public life.",East Asia,Economy,
Larry Page,1973-03-26,,American,"Co-founded Google with Sergey Brin, creating world's dominant search engine and reshaping how humanity accesses information.",North America,Economy,
Sergey Brin,1973-08-21,,Russian-American,"Co-founded Google with Larry Page. Born in Soviet Union, immigrated to US, helped create technologies that transformed the internet.",North America,Economy,
Barack Obama,1961-08-04,,American,"First African-American US President (2009-2017). Passed Affordable Care Act, navigated 2008 financial crisis, authorized operation that killed Osama bin Laden.",North America,Politics & Military,
Donald Trump,1946-06-14,,American,"US President (2017-2021), businessman and media personality. Controversial presidency marked by trade wars, immigration policies, and two impeachments.",North America,Politics & Military,
Angela Merkel,1954-07-17,,German,"German Chancellor (2005-2021), longest-serving leader in modern European history. Led through eurozone crisis and refugee crisis, symbol of European stability.",Europe,Politics & Military,
Margaret Thatcher,1925-10-13,2013-04-08,British,"First female British Prime Minister (1979-1990). Conservative leader who privatized industries, broke union power, and worked with Reagan to end Cold War.",Europe,Politics & Military,
Tony Blair,1953-05-06,,British,British Prime Minister (1997-2007) who modernized Labour Party. Legacy complicated by Iraq War involvement alongside George W. Bush.,Europe,Politics & Military,
Emmanuel Macron,1977-12-21,,French,"French President (2017-present), youngest since Napoleon. Centrist reformer facing challenges from both left and right populism.",Europe,Politics & Military,
Vladimir Putin,1952-10-07,,Russian,"Russian President/Prime Minister since 1999. Consolidated authoritarian control, annexed Crimea, invaded Ukraine, reasserted Russian power globally.",Europe,Politics & Military,
Xi Jinping (習近平),1953-06-15,,Chinese,"Chinese President (2012-present) who consolidated power, eliminated term limits, intensified surveillance state, and pursued aggressive foreign policy.",East Asia,Politics & Military,
Recep Tayyip Erdogan,1954-02-26,,Turkish,"Turkish President who transformed Turkey from parliamentary to presidential system. Increasingly authoritarian, expanded Turkish regional influence.",Middle East,Politics & Military,
Narendra Modi,1950-09-17,,Indian,Indian Prime Minister (2014-present) who promoted Hindu nationalism and economic development. Controversial for religious tensions and democratic backsliding concerns.,South Asia,Politics & Military,
Benjamin Netanyahu,1949-10-21,,Israeli,"Longest-serving Israeli Prime Minister. Dominated Israeli politics for decades, hardline on Palestinians, strengthened ties with Arab states.",Middle East,Politics & Military,
Mikhail Gorbachev,1931-03-02,2022-08-30,Soviet-Russian,Last Soviet leader whose glasnost and perestroika reforms led to end of Cold War and Soviet Union's collapse. Nobel Peace Prize winner.,Europe,Politics & Military,
Nelson Mandela,1918-07-18,2013-12-05,South African,"Anti-apartheid revolutionary who became South Africa's first Black president. Symbol of reconciliation and human rights, spent 27 years imprisoned.",Africa,Politics & Military,
Aung San Suu Kyi,1945-06-19,,Burmese,"Democracy activist who spent years under house arrest, won Nobel Peace Prize. Later led Myanmar government but legacy tarnished by Rohingya crisis.",East Asia,Politics & Military,
Malala Yousafzai,1997-07-12,,Pakistani,"Education activist who survived Taliban assassination attempt. Youngest Nobel Prize winner, advocates for girls' education worldwide.",South Asia,Politics & Military,
Greta Thunberg,2003-01-03,,Swedish,Youth climate activist who inspired global climate strikes. Symbol of young generation's climate activism and urgency.,Europe,Politics & Military,
Ai Weiwei (艾未未),1957-08-28,,Chinese,Artist and activist who challenges Chinese government through art. Imprisoned and exiled for political activism and human rights advocacy.,East Asia,Visual Arts,
Desmond Tutu,1931-10-07,2021-12-26,South African,"Anglican archbishop and anti-apartheid activist. Led Truth and Reconciliation Commission, symbol of moral leadership and social justice.",Africa,Religion,
Stephen Hawking,1942-01-08,2018-03-14,British,Theoretical physicist who revolutionized understanding of black holes and cosmology despite ALS. Made complex science accessible to public.,Europe,Science,
Tim Berners-Lee,1955-06-08,,British,"Invented the World Wide Web in 1989, fundamentally transforming global communication, commerce, and information sharing.",Europe,Science,
Craig Venter,1946-10-14,,American,Led private effort to sequence human genome. Pioneer in synthetic biology and personalized medicine.,North America,Science,
Tu Youyou (屠呦呦),1930-12-30,,Chinese,"Discovered artemisinin for malaria treatment, saving millions of lives. First Chinese woman to win Nobel Prize in Physiology or Medicine.",East Asia,Science,
Jennifer Doudna,1964-02-19,,American,"Co-developed CRISPR gene editing technology, revolutionary tool for genetic engineering. Nobel Prize winner raising ethical questions about human genome editing.",North America,Science,
Toni Morrison,1931-02-18,2019-08-05,American,"Nobel Prize-winning novelist whose works explored African-American experience. Author of Beloved, Song of Solomon, and other masterworks.",North America,Literature,
Gabriel García Márquez,1927-03-06,2014-04-17,Colombian,"Nobel Prize-winning author of One Hundred Years of Solitude. Pioneer of magical realism, most influential Latin American writer of modern era.",South America,Literature,
Haruki Murakami (村上春樹),1949-01-12,,Japanese,Internationally acclaimed novelist blending surrealism with contemporary themes. Works like Norwegian Wood and 1Q84 achieved global popularity.,East Asia,Literature,
Chimamanda Ngozi Adichie,1977-09-15,,Nigerian,"Acclaimed novelist and feminist voice. Author of Americanah and Half of a Yellow Sun, TED talk on feminism viewed millions of times.",Africa,Literature,
Michael Jackson,1958-08-29,2009-06-25,American,"King of Pop whose music, dance, and videos transformed popular culture globally. Thriller remains best-selling album ever, controversial personal life.",North America,Music,
Beyoncé,1981-09-04,,American,"Global superstar who transcended music to become cultural icon. Groundbreaking visual albums, powerful performances, advocate for Black culture and feminism.",North America,Music,
Taylor Swift,1989-12-13,,American,One of best-selling music artists who evolved from country to pop to alternative. Cultural phenomenon with massive fanbase and industry influence.,North America,Music,
BTS (K-pop group representative),1990-01-01,,South Korean,"Global K-pop phenomenon that broke Western music barriers. Symbol of Korean Wave cultural influence worldwide, ARMY fanbase unprecedented in scale.",East Asia,Music,
Steven Spielberg,1946-12-18,,American,"Most commercially successful director in history. Created Jaws, E.T., Jurassic Park, Schindler's List, shaped modern blockbuster cinema.",North America,Visual Arts,
Oprah Winfrey,1954-01-29,,American,"Media mogul whose talk show dominated daytime TV. First Black female billionaire, influential philanthropist and cultural tastemaker.",North America,Economy,
Michael Jordan,1963-02-17,,American,"Greatest basketball player who globalized NBA and transformed athlete branding. Six championships, cultural icon beyond sports.",North America,Politics & Military,
Lionel Messi,1987-06-24,,Argentine,"Considered greatest footballer ever alongside Ronaldo. Won record Ballon d'Ors, led Argentina to World Cup victory in 2022.",South America,Politics & Military,
Cristiano Ronaldo,1985-02-05,,Portuguese,"Five-time Ballon d'Or winner, all-time top scorer in football history. Global brand transcending sport, rivalry with Messi defined an era.",Europe,Politics & Military,
Serena Williams,1981-09-26,,American,"Dominant tennis player with 23 Grand Slam singles titles. Broke barriers as Black woman in tennis, advocate for equality and body positivity.",North America,Politics & Military,
Usain Bolt,1986-08-21,,Jamaican,"Fastest human ever, eight-time Olympic gold medalist. World records in 100m and 200m, transcended track and field as global personality.",North America,Politics & Military,
Pope John Paul II,1920-05-18,2005-04-02,Polish,"First non-Italian pope in 455 years whose 27-year papacy influenced collapse of communism. Traveled extensively, modernized Catholic Church outreach.",Europe,Religion,
Pope Francis,1936-12-17,,Argentine,"First Latin American and Jesuit pope. Progressive on social issues, environmental advocate, emphasized mercy and inclusion over doctrine.",South America,Religion,
Dalai Lama (14th),1935-07-06,,Tibetan,"Spiritual leader of Tibetan Buddhism and symbol of Tibetan independence. Nobel Peace Prize winner, advocate for compassion and nonviolence in exile.",East Asia,Religion,
